keyword,topic_cluster,intent,page_url,current_page_exists,competition_level,content_gap,social_angle,priority_score,next_action
cursor vs codex,AI coding tools,comparison,,false,low,missing_page,comparison debate / practical tradeoff,75,build_comparison_page
cursor vs copilot debugging speed,AI coding tools,comparison,,false,low,missing_page,comparison debate / practical tradeoff,75,build_comparison_page
ai coding tool reviews,AI coding tools,review,,false,low,missing_page,practical review / use case,68,build_review_page
ai design software review,general,review,,false,low,missing_page,practical review / use case,68,build_review_page
ai design tool reviews,general,review,,false,low,missing_page,practical review / use case,68,build_review_page
ai meeting tool reviews,general,review,,false,low,missing_page,practical review / use case,68,build_review_page
ai productivity tool reviews,general,review,,false,low,missing_page,practical review / use case,68,build_review_page
ai seo tool reviews,AI SEO tools,review,,false,low,missing_page,practical review / use case,68,build_review_page
ai video software review,general,review,,false,low,missing_page,practical review / use case,68,build_review_page
ai video tool reviews,general,review,,false,low,missing_page,practical review / use case,68,build_review_page
ai voice tool reviews,general,review,,false,low,missing_page,practical review / use case,68,build_review_page
ai writing software review,AI writing tools,review,,false,low,missing_page,practical review / use case,68,build_review_page
ai writing tool reviews,AI writing tools,review,,false,low,missing_page,practical review / use case,68,build_review_page
automation tool reviews,AI automation tools,review,,false,low,missing_page,practical review / use case,68,build_review_page
crm software review,general,review,,false,low,missing_page,practical review / use case,68,build_review_page
crm tool reviews,general,review,,false,low,missing_page,practical review / use case,68,build_review_page
marketing tool reviews,general,review,,false,low,missing_page,practical review / use case,68,build_review_page
productivity tool reviews,general,review,,false,low,missing_page,practical review / use case,68,build_review_page
ai coding software comparison,AI coding tools,comparison,,false,low,missing_page,comparison debate / practical tradeoff,65,build_comparison_page
ai design software comparison,general,comparison,,false,low,missing_page,comparison debate / practical tradeoff,65,build_comparison_page
ai meeting software comparison,general,comparison,,false,low,missing_page,comparison debate / practical tradeoff,65,build_comparison_page
ai productivity software comparison,general,comparison,,false,low,missing_page,comparison debate / practical tradeoff,65,build_comparison_page
ai seo software comparison,AI SEO tools,comparison,,false,low,missing_page,comparison debate / practical tradeoff,65,build_comparison_page
ai video software comparison,general,comparison,,false,low,missing_page,comparison debate / practical tradeoff,65,build_comparison_page
ai voice software comparison,general,comparison,,false,low,missing_page,comparison debate / practical tradeoff,65,build_comparison_page
ai writing software comparison,AI writing tools,comparison,,false,low,missing_page,comparison debate / practical tradeoff,65,build_comparison_page
automation software comparison,AI automation tools,comparison,,false,low,missing_page,comparison debate / practical tradeoff,65,build_comparison_page
crm software comparison,general,comparison,,false,low,missing_page,comparison debate / practical tradeoff,65,build_comparison_page
marketing software comparison,general,comparison,,false,low,missing_page,comparison debate / practical tradeoff,65,build_comparison_page
productivity software comparison,general,comparison,,false,low,missing_page,comparison debate / practical tradeoff,65,build_comparison_page
coupon code,general,review,,false,medium,missing_page,practical review / use case,62,build_review_page
best ai coding software,AI coding tools,best_tools,,false,medium,missing_page,shortlist / decision guide,61,build_best_tools_page
best ai design software,general,best_tools,,false,medium,missing_page,shortlist / decision guide,61,build_best_tools_page
best ai meeting software,general,best_tools,,false,medium,missing_page,shortlist / decision guide,61,build_best_tools_page
best ai meeting tools,general,best_tools,,false,medium,missing_page,shortlist / decision guide,61,build_best_tools_page
best ai productivity software,general,best_tools,,false,medium,missing_page,shortlist / decision guide,61,build_best_tools_page
best ai productivity tools,general,best_tools,,false,medium,missing_page,shortlist / decision guide,61,build_best_tools_page
best ai seo software,AI SEO tools,best_tools,,false,medium,missing_page,shortlist / decision guide,61,build_best_tools_page
best ai video software,general,best_tools,,false,medium,missing_page,shortlist / decision guide,61,build_best_tools_page
best ai voice software,general,best_tools,,false,medium,missing_page,shortlist / decision guide,61,build_best_tools_page
best ai voice tools,general,best_tools,,false,medium,missing_page,shortlist / decision guide,61,build_best_tools_page
best ai writing software,AI writing tools,best_tools,,false,medium,missing_page,shortlist / decision guide,61,build_best_tools_page
best automation software,AI automation tools,best_tools,,false,medium,missing_page,shortlist / decision guide,61,build_best_tools_page
best crm software,general,best_tools,,false,medium,missing_page,shortlist / decision guide,61,build_best_tools_page
best marketing software,general,best_tools,,false,medium,missing_page,shortlist / decision guide,61,build_best_tools_page
best productivity software,general,best_tools,,false,medium,missing_page,shortlist / decision guide,61,build_best_tools_page
best productivity tools,general,best_tools,,false,medium,missing_page,shortlist / decision guide,61,build_best_tools_page
affordable ai coding platform,AI coding tools,review,,false,low,missing_page,practical review / use case,59,monitor
affordable ai design platform,general,review,,false,low,missing_page,practical review / use case,59,monitor
affordable ai meeting platform,general,review,,false,low,missing_page,practical review / use case,59,monitor
affordable ai productivity platform,general,review,,false,low,missing_page,practical review / use case,59,monitor
affordable ai seo platform,AI SEO tools,review,,false,low,missing_page,practical review / use case,59,monitor
affordable ai video platform,general,review,,false,low,missing_page,practical review / use case,59,monitor
affordable ai voice platform,general,review,,false,low,missing_page,practical review / use case,59,monitor
affordable ai writing platform,AI writing tools,review,,false,low,missing_page,practical review / use case,59,monitor
affordable automation platform,AI automation tools,review,,false,low,missing_page,practical review / use case,59,monitor
affordable crm platform,general,review,,false,low,missing_page,practical review / use case,59,monitor
affordable marketing platform,general,review,,false,low,missing_page,practical review / use case,59,monitor
affordable productivity platform,general,review,,false,low,missing_page,practical review / use case,59,monitor
affordable website builder platform,general,review,,false,low,missing_page,practical review / use case,59,monitor
cursor for builders,AI coding tools,review,,false,low,missing_page,practical review / use case,59,monitor
cursor hay copilot,AI coding tools,review,,false,low,missing_page,practical review / use case,59,monitor
how to automate ai coding,AI coding tools,tutorial,,false,low,missing_page,practical review / use case,59,monitor
how to automate ai design,general,tutorial,,false,low,missing_page,practical review / use case,59,monitor
how to automate ai meeting,general,tutorial,,false,low,missing_page,practical review / use case,59,monitor
how to automate ai productivity,general,tutorial,,false,low,missing_page,practical review / use case,59,monitor
how to automate ai seo,AI SEO tools,tutorial,,false,low,missing_page,practical review / use case,59,monitor
how to automate ai video,general,tutorial,,false,low,missing_page,practical review / use case,59,monitor
how to automate ai voice,general,tutorial,,false,low,missing_page,practical review / use case,59,monitor
how to automate ai writing,AI writing tools,tutorial,,false,low,missing_page,practical review / use case,59,monitor
how to automate automation,AI automation tools,tutorial,,false,low,missing_page,practical review / use case,59,monitor
how to automate crm,general,tutorial,,false,low,missing_page,practical review / use case,59,monitor
how to automate email marketing,general,tutorial,,false,low,missing_page,practical review / use case,59,monitor
how to automate marketing,general,tutorial,,false,low,missing_page,practical review / use case,59,monitor
how to automate productivity,general,tutorial,,false,low,missing_page,practical review / use case,59,monitor
how to automate website builder,general,tutorial,,false,low,missing_page,practical review / use case,59,monitor
my actual ai coding workflow in,AI coding tools,tutorial,,false,low,missing_page,builder workflow / failure case,59,monitor
solve ai coding workflow,AI coding tools,tutorial,,false,low,missing_page,builder workflow / failure case,59,monitor
solve ai design workflow,AI automation tools,tutorial,,false,low,missing_page,builder workflow / failure case,59,monitor
solve ai meeting workflow,AI automation tools,tutorial,,false,low,missing_page,builder workflow / failure case,59,monitor
solve ai productivity workflow,AI automation tools,tutorial,,false,low,missing_page,builder workflow / failure case,59,monitor
solve ai seo workflow,AI SEO tools,tutorial,,false,low,missing_page,builder workflow / failure case,59,monitor
solve ai video workflow,AI automation tools,tutorial,,false,low,missing_page,builder workflow / failure case,59,monitor
solve ai voice workflow,AI automation tools,tutorial,,false,low,missing_page,builder workflow / failure case,59,monitor
solve ai writing workflow,AI writing tools,tutorial,,false,low,missing_page,builder workflow / failure case,59,monitor
solve automation workflow,AI automation tools,tutorial,,false,low,missing_page,builder workflow / failure case,59,monitor
solve crm workflow,AI automation tools,tutorial,,false,low,missing_page,builder workflow / failure case,59,monitor
solve marketing workflow,AI automation tools,tutorial,,false,low,missing_page,builder workflow / failure case,59,monitor
solve productivity workflow,AI automation tools,tutorial,,false,low,missing_page,builder workflow / failure case,59,monitor
when codex fixes what cursor breaks,AI coding tools,tutorial,,false,low,missing_page,practical review / use case,59,monitor
which ai survives the second failed fix,general,tutorial,,false,low,missing_page,practical review / use case,59,monitor
windsurf + codex workflow,AI coding tools,tutorial,,false,low,missing_page,builder workflow / failure case,59,monitor
copilot vs codex practical comparison for real developers and ai builders ms smile ai hub,AI coding tools,comparison,/comparisons/copilot-vs-codex/,true,low,thin_content,comparison debate / practical tradeoff,58,expand_content_depth
crack,general,review,,false,medium,missing_page,practical review / use case,57,monitor
general,general,review,,false,medium,missing_page,practical review / use case,57,monitor
nulled,general,review,,false,medium,missing_page,practical review / use case,57,monitor
salary,general,review,,false,medium,missing_page,practical review / use case,57,monitor
semrush angle,AI SEO tools,review,,false,medium,missing_page,practical review / use case,57,monitor
torrent,general,review,,false,medium,missing_page,practical review / use case,57,monitor
activecampaign for email marketing buyers workflow fit checks and alternatives ms smile ai hub,AI automation tools,alternative,/review/activecampaign/,true,low,thin_content,switching story / alternatives,56,expand_content_depth
adcreative ai for marketing buyers workflow fit checks and alternatives ms smile ai hub,AI automation tools,alternative,/review/adcreative-ai/,true,low,thin_content,switching story / alternatives,56,expand_content_depth
ai writing tools need editors,AI writing tools,review,,false,medium,missing_page,practical review / use case,56,monitor
canva for ai design buyers workflow fit checks and alternatives ms smile ai hub,AI automation tools,alternative,/review/canva/,true,low,thin_content,switching story / alternatives,56,expand_content_depth
copilot vs cursor,AI coding tools,comparison,/comparisons/copilot-vs-cursor/,true,low,thin_content,comparison debate / practical tradeoff,56,expand_content_depth
copilot vs cursor enterprise assistant or ai first coding editor,AI coding tools,comparison,/comparisons/copilot-vs-cursor/,true,low,thin_content,comparison debate / practical tradeoff,56,expand_content_depth
copy.ai for ai writing buyers workflow fit checks and alternatives ms smile ai hub,AI writing tools,alternative,/review/copy-ai/,true,low,thin_content,switching story / alternatives,56,expand_content_depth
cursor for ai coding buyers workflow fit checks and alternatives ms smile ai hub,AI coding tools,alternative,/review/cursor/,true,low,thin_content,switching story / alternatives,56,expand_content_depth
descript for ai video buyers workflow fit checks and alternatives ms smile ai hub,AI automation tools,alternative,/review/descript/,true,low,thin_content,switching story / alternatives,56,expand_content_depth
durable for website builder buyers workflow fit checks and alternatives ms smile ai hub,AI automation tools,alternative,/review/durable/,true,low,thin_content,switching story / alternatives,56,expand_content_depth
elevenlabs for ai voice buyers workflow fit checks and alternatives ms smile ai hub,AI automation tools,alternative,/review/elevenlabs/,true,low,thin_content,switching story / alternatives,56,expand_content_depth
framer for website builder buyers workflow fit checks and alternatives ms smile ai hub,AI automation tools,alternative,/review/framer/,true,low,thin_content,switching story / alternatives,56,expand_content_depth
gamma for ai productivity buyers workflow fit checks and alternatives ms smile ai hub,AI automation tools,alternative,/review/gamma/,true,low,thin_content,switching story / alternatives,56,expand_content_depth
github copilot for ai coding buyers workflow fit checks and alternatives ms smile ai hub,AI coding tools,alternative,/review/github-copilot/,true,low,thin_content,switching story / alternatives,56,expand_content_depth
hubspot for crm buyers workflow fit checks and alternatives ms smile ai hub,AI automation tools,alternative,/review/hubspot/,true,low,thin_content,switching story / alternatives,56,expand_content_depth
jasper ai for ai writing buyers workflow fit checks and alternatives ms smile ai hub,AI writing tools,alternative,/review/jasper/,true,low,thin_content,switching story / alternatives,56,expand_content_depth
jasper for ai writing buyers workflow fit checks and alternatives ms smile ai hub,AI writing tools,alternative,/review/jasper/,true,low,thin_content,switching story / alternatives,56,expand_content_depth
make for automation buyers workflow fit checks and alternatives ms smile ai hub,AI automation tools,alternative,/review/make/,true,low,thin_content,switching story / alternatives,56,expand_content_depth
notion ai for ai productivity buyers workflow fit checks and alternatives ms smile ai hub,AI automation tools,alternative,/review/notion/,true,low,thin_content,switching story / alternatives,56,expand_content_depth
notion for productivity buyers workflow fit checks and alternatives ms smile ai hub,AI automation tools,alternative,/review/notion/,true,low,thin_content,switching story / alternatives,56,expand_content_depth
pipedrive crm for crm buyers workflow fit checks and alternatives ms smile ai hub,AI automation tools,alternative,/review/pipedrive/,true,low,thin_content,switching story / alternatives,56,expand_content_depth
pipedrive for crm buyers workflow fit checks and alternatives ms smile ai hub,AI automation tools,alternative,/review/pipedrive/,true,low,thin_content,switching story / alternatives,56,expand_content_depth
reclaim ai for ai meeting buyers workflow fit checks and alternatives ms smile ai hub,AI automation tools,alternative,/review/reclaim-ai/,true,low,thin_content,switching story / alternatives,56,expand_content_depth
runway for ai video buyers workflow fit checks and alternatives ms smile ai hub,AI automation tools,alternative,/review/runway/,true,low,thin_content,switching story / alternatives,56,expand_content_depth
semrush for ai seo buyers workflow fit checks and alternatives ms smile ai hub,AI SEO tools,alternative,/review/semrush/,true,low,thin_content,switching story / alternatives,56,expand_content_depth
surfer seo for ai seo buyers workflow fit checks and alternatives ms smile ai hub,AI SEO tools,alternative,/review/surfer-seo/,true,low,thin_content,switching story / alternatives,56,expand_content_depth
synthesia for ai video buyers workflow fit checks and alternatives ms smile ai hub,AI automation tools,alternative,/review/synthesia/,true,low,thin_content,switching story / alternatives,56,expand_content_depth
webflow ai for website builder buyers workflow fit checks and alternatives ms smile ai hub,AI automation tools,alternative,/review/webflow/,true,low,thin_content,switching story / alternatives,56,expand_content_depth
webflow for website builder buyers workflow fit checks and alternatives ms smile ai hub,AI automation tools,alternative,/review/webflow/,true,low,thin_content,switching story / alternatives,56,expand_content_depth
why i stopped using only one ai coding tool,AI coding tools,review,,false,medium,missing_page,practical review / use case,56,monitor
zapier for automation buyers workflow fit checks and alternatives ms smile ai hub,AI automation tools,alternative,/review/zapier/,true,low,thin_content,switching story / alternatives,56,expand_content_depth
activecampaign vs mailchimp,comparisons,comparison,/compare/activecampaign-vs-mailchimp/,true,low,thin_content,comparison debate / practical tradeoff,53,expand_content_depth
activecampaign vs mailchimp which email marketing platforms should you choose,comparisons,comparison,/compare/activecampaign-vs-mailchimp/,true,low,thin_content,comparison debate / practical tradeoff,53,expand_content_depth
best ai coding alternatives for ms smile ai hub,AI coding tools,alternative,/ai-coding-alternatives/,true,low,thin_content,switching story / alternatives,53,expand_content_depth
best ai design alternatives for ms smile ai hub,alternatives,alternative,/ai-design-alternatives/,true,low,thin_content,switching story / alternatives,53,expand_content_depth
best ai meeting alternatives for ms smile ai hub,alternatives,alternative,/ai-meeting-alternatives/,true,low,thin_content,switching story / alternatives,53,expand_content_depth
best ai productivity alternatives for ms smile ai hub,alternatives,alternative,/ai-productivity-alternatives/,true,low,thin_content,switching story / alternatives,53,expand_content_depth
best ai seo alternatives for ms smile ai hub,AI SEO tools,alternative,/ai-seo-alternatives/,true,low,thin_content,switching story / alternatives,53,expand_content_depth
best ai video alternatives for ms smile ai hub,alternatives,alternative,/ai-video-alternatives/,true,low,thin_content,switching story / alternatives,53,expand_content_depth
best ai voice alternatives for ms smile ai hub,alternatives,alternative,/ai-voice-alternatives/,true,low,thin_content,switching story / alternatives,53,expand_content_depth
best ai writing alternatives for ms smile ai hub,AI writing tools,alternative,/ai-writing-alternatives/,true,low,thin_content,switching story / alternatives,53,expand_content_depth
best alternatives to canva ai,alternatives,alternative,/blog/best-alternatives-to-canva-ai/,true,low,thin_content,switching story / alternatives,53,expand_content_depth
best alternatives to canva ai ms smile ai hub,alternatives,alternative,/blog/best-alternatives-to-canva-ai/,true,low,thin_content,switching story / alternatives,53,expand_content_depth
best automation alternatives for ms smile ai hub,AI automation tools,alternative,/automation-alternatives/,true,low,thin_content,switching story / alternatives,53,expand_content_depth
best crm alternatives for ms smile ai hub,alternatives,alternative,/crm-alternatives/,true,low,thin_content,switching story / alternatives,53,expand_content_depth
best email marketing alternatives for ms smile ai hub,alternatives,alternative,/email-marketing-alternatives/,true,low,thin_content,switching story / alternatives,53,expand_content_depth
best marketing alternatives for ms smile ai hub,alternatives,alternative,/email-marketing-alternatives/,true,low,thin_content,switching story / alternatives,53,expand_content_depth
best productivity alternatives for ms smile ai hub,alternatives,alternative,/ai-productivity-alternatives/,true,low,thin_content,switching story / alternatives,53,expand_content_depth
best website builder alternatives for ms smile ai hub,alternatives,alternative,/website-builder-alternatives/,true,low,thin_content,switching story / alternatives,53,expand_content_depth
canva vs adcreative ai,comparisons,comparison,/compare/canva-vs-adcreative-ai/,true,low,thin_content,comparison debate / practical tradeoff,53,expand_content_depth
canva vs adobe express,comparisons,comparison,/comparisons/canva-vs-adobe-express/,true,low,thin_content,comparison debate / practical tradeoff,53,expand_content_depth
canva vs adobe express which tool should you choose in,comparisons,comparison,/comparisons/canva-vs-adobe-express/,true,low,thin_content,comparison debate / practical tradeoff,53,expand_content_depth
canva vs gamma,comparisons,comparison,/comparisons/canva-vs-gamma/,true,low,thin_content,comparison debate / practical tradeoff,53,expand_content_depth
chatgpt vs claude,comparisons,comparison,/comparisons/chatgpt-vs-claude/,true,low,thin_content,comparison debate / practical tradeoff,53,expand_content_depth
chatgpt vs claude which ai assistants should you choose,comparisons,comparison,/comparisons/chatgpt-vs-claude/,true,low,thin_content,comparison debate / practical tradeoff,53,expand_content_depth
chatgpt vs gemini,comparisons,comparison,/comparisons/chatgpt-vs-gemini/,true,low,thin_content,comparison debate / practical tradeoff,53,expand_content_depth
chatgpt vs gemini ms smile ai hub,comparisons,comparison,/comparisons/chatgpt-vs-gemini/,true,low,thin_content,comparison debate / practical tradeoff,53,expand_content_depth
copilot vs codex,AI coding tools,comparison,/comparisons/copilot-vs-codex/,true,low,thin_content,comparison debate / practical tradeoff,53,expand_content_depth
copilot vs tabnine,AI coding tools,comparison,/comparisons/copilot-vs-tabnine/,true,low,thin_content,comparison debate / practical tradeoff,53,expand_content_depth
cursor vs copilot,AI coding tools,comparison,/comparisons/cursor-vs-copilot/,true,low,thin_content,comparison debate / practical tradeoff,53,expand_content_depth
cursor vs github copilot,AI coding tools,comparison,/compare/cursor-vs-github-copilot/,true,low,thin_content,comparison debate / practical tradeoff,53,expand_content_depth
cursor vs github copilot which ai coding assistants should you choose,AI coding tools,comparison,/compare/cursor-vs-github-copilot/,true,low,thin_content,comparison debate / practical tradeoff,53,expand_content_depth
cursor vs github copilot which tool should you choose in,AI coding tools,comparison,/comparisons/cursor-vs-copilot/,true,low,thin_content,comparison debate / practical tradeoff,53,expand_content_depth
cursor vs vs code ms smile ai hub,AI coding tools,comparison,/comparisons/cursor-vs-vscode/,true,low,thin_content,comparison debate / practical tradeoff,53,expand_content_depth
cursor vs vscode,AI coding tools,comparison,/comparisons/cursor-vs-vscode/,true,low,thin_content,comparison debate / practical tradeoff,53,expand_content_depth
cursor vs windsurf,AI coding tools,comparison,/compare/cursor-vs-windsurf/,true,low,thin_content,comparison debate / practical tradeoff,53,expand_content_depth
cursor vs windsurf which ai coding editor fits real development work,AI coding tools,comparison,/comparisons/cursor-vs-windsurf/,true,low,thin_content,comparison debate / practical tradeoff,53,expand_content_depth
cursor vs windsurf which ai coding editors should you choose,AI coding tools,comparison,/compare/cursor-vs-windsurf/,true,low,thin_content,comparison debate / practical tradeoff,53,expand_content_depth
elevenlabs vs murf,comparisons,comparison,/comparisons/elevenlabs-vs-murf/,true,low,thin_content,comparison debate / practical tradeoff,53,expand_content_depth
elevenlabs vs playht,comparisons,comparison,/comparisons/elevenlabs-vs-playht/,true,low,thin_content,comparison debate / practical tradeoff,53,expand_content_depth
elevenlabs vs playht ms smile ai hub,comparisons,comparison,/comparisons/elevenlabs-vs-playht/,true,low,thin_content,comparison debate / practical tradeoff,53,expand_content_depth
framer vs webflow,comparisons,comparison,/comparisons/framer-vs-webflow/,true,low,thin_content,comparison debate / practical tradeoff,53,expand_content_depth
framer vs webflow ms smile ai hub,comparisons,comparison,/comparisons/framer-vs-webflow/,true,low,thin_content,comparison debate / practical tradeoff,53,expand_content_depth
gemini vs claude,comparisons,comparison,/comparisons/gemini-vs-claude/,true,low,thin_content,comparison debate / practical tradeoff,53,expand_content_depth
gemini vs claude ms smile ai hub,comparisons,comparison,/comparisons/gemini-vs-claude/,true,low,thin_content,comparison debate / practical tradeoff,53,expand_content_depth
