rank,topic,slug,article_type,estimated_monthly_traffic,affiliate_conversion_rate,estimated_revenue_score,estimated_value,affiliate_score,money_score,final_score,recommended_action
1,free-for-dev Review 2026,free-for-dev-review-2026,review,1314,0.072,100,1490.08,63.0,73.6,59.1,REFRESH
2,ai-berkshire Review 2026,ai-berkshire-review-2026,review,1242,0.07,100,1369.31,63.0,72.9,58.8,REFRESH
3,agency-agents Review 2026,agency-agents-review-2026,review,1242,0.07,100,1369.31,63.0,72.9,58.6,REFRESH
4,logto Review 2026,logto-review-2026,review,1188,0.072,100,1347.19,63.0,73.0,57.1,REFRESH
5,VulnClaw Review 2026,vulnclaw-review-2026,review,1170,0.072,100,1326.78,63.0,72.9,57.1,REFRESH
6,council-of-high-intelligence Review 2026,council-of-high-intelligence-review-2026,review,1224,0.065,100,1153.62,58.0,69.4,56.3,REFRESH
7,cupy Review 2026,cupy-review-2026,review,1152,0.064,100,1069.06,58.0,68.8,56.0,REFRESH
8,best ai search software,best-ai-search-software,best list,1044,0.066,100,1136.92,66.0,65.2,55.7,REFRESH
9,"Tavant debuts agentic AI platform for software engineering, automation",tavant-debuts-agentic-ai-platform-for-software-engineering-automation,evergreen,864,0.075,100,1036.8,64.0,68.7,55.6,REFRESH
10,affordable ai search platform,affordable-ai-search-platform,evergreen,1044,0.061,100,859.73,54.0,56.8,55.0,REFRESH
11,best ai productivity software,best-ai-productivity-software,best list,1116,0.068,100,1252.15,66.0,65.8,54.8,MONITOR
12,best productivity software,best-productivity-software,best list,1116,0.068,100,1252.15,66.0,65.8,54.8,MONITOR
13,best ai image software,best-ai-image-software,best list,1044,0.066,100,1136.92,66.0,65.2,54.5,MONITOR
14,best ai meeting software,best-ai-meeting-software,best list,1044,0.066,100,1136.92,66.0,65.2,54.5,MONITOR
15,best productivity tools,best-productivity-tools,best list,1116,0.068,100,1252.15,66.0,64.1,54.3,MONITOR
16,best ai image tools,best-ai-image-tools,best list,1044,0.066,100,1136.92,66.0,63.4,54.1,MONITOR
17,best ai meeting tools,best-ai-meeting-tools,best list,1044,0.066,100,1136.92,66.0,63.4,54.1,MONITOR
18,affordable ai design platform,affordable-ai-design-platform,evergreen,1044,0.061,100,859.73,54.0,56.8,53.8,MONITOR
19,affordable ai image platform,affordable-ai-image-platform,evergreen,1044,0.061,100,859.73,54.0,56.8,53.8,MONITOR
20,affordable ai meeting platform,affordable-ai-meeting-platform,evergreen,1044,0.061,100,859.73,54.0,56.8,53.8,MONITOR
21,The best AI coding tool isn't the one that writes the most code,the-best-ai-coding-tool-isn-t-the-one-that-writes-the-most-code,best list,936,0.069,100,1065.64,66.0,66.5,52.8,MONITOR
22,12 Best AI for Coding Tools in 2026 (Vibecoding & Data Science),12-best-ai-for-coding-tools-in-2026-vibecoding-data-science,best list,792,0.066,100,862.49,66.0,63.5,51.8,MONITOR
23,best ai voice software,best-ai-voice-software,best list,1044,0.066,100,1136.92,66.0,65.2,51.3,MONITOR
24,AI shakes SaaS as markets plunge and Korea races to reinvent software,ai-shakes-saas-as-markets-plunge-and-korea-races-to-reinvent-software,evergreen,936,0.076,100,1138.18,64.0,64.7,51.2,MONITOR
25,affordable ai voice platform,affordable-ai-voice-platform,evergreen,1044,0.061,100,859.73,54.0,56.8,50.6,MONITOR
26,PayU Brings AI Coding And CLI Tools To Payment Developers,payu-brings-ai-coding-and-cli-tools-to-payment-developers,evergreen,936,0.068,100,938.81,59.0,58.0,50.3,MONITOR
27,Gradial Lands $65M Series C for Agentic Marketing Platform,gradial-lands-65m-series-c-for-agentic-marketing-platform,evergreen,864,0.069,100,879.34,59.0,60.3,49.6,MONITOR
28,I signed up for another SaaS,i-signed-up-for-another-saas,evergreen,864,0.069,100,879.34,59.0,60.3,49.6,MONITOR
29,How AI is upending SaaS tools,how-ai-is-upending-saas-tools,evergreen,864,0.072,100,995.33,64.0,59.8,47.5,MONITOR
30,AI coding tokens could soon cost as much as salaries,ai-coding-tokens-could-soon-cost-as-much-as-salaries,pricing,936,0.066,98.5,787.64,51.0,67.8,54.7,MONITOR
31,Open AI delayed GPT-5.6 after a U.S. government review request. Is AI regulation becoming the new normal?,open-ai-delayed-gpt-5-6-after-a-u-s-government-review-request-is-ai-regulation-becoming-the-new-normal,review,792,0.064,91.9,734.98,58.0,67.3,52.3,MONITOR
32,Is SaaS dead?,is-saas-dead,evergreen,864,0.062,90.4,723.17,54.0,54.7,47.7,MONITOR
33,"CMO Vision: AI Is Rewiring How Marketing Is Understood, Shaped And Scaled",cmo-vision-ai-is-rewiring-how-marketing-is-understood-shaped-and-scaled,evergreen,936,0.059,79.4,635.08,46.0,56.0,47.3,MONITOR
34,Tidal AI Policy,tidal-ai-policy,evergreen,1152,0.05,73.8,590.4,41.0,49.1,49.0,MONITOR
35,Ornith-1.0: self-improving open-source models for agentic coding,ornith-1-0-self-improving-open-source-models-for-agentic-coding,evergreen,1116,0.05,71.5,571.95,41.0,50.0,52.3,MONITOR
36,"Impartner Redefines Partner Marketing Automation with Full Automation, AdTech and AI to Drive Measurable Revenue",impartner-redefines-partner-marketing-automation-with-full-automation-adtech-and-ai-to-drive-measurable-revenue,evergreen,864,0.057,70.8,566.35,46.0,54.8,50.5,MONITOR
37,Search Marketing’s Insight Gap: When Automation Replaces Understanding,search-marketing-s-insight-gap-when-automation-replaces-understanding,evergreen,864,0.057,70.8,566.35,46.0,54.8,50.5,MONITOR
38,The Future of Matrix Marketing: How AI and Environment Isolation are Replacing Legacy RPA,the-future-of-matrix-marketing-how-ai-and-environment-isolation-are-replacing-legacy-rpa,evergreen,864,0.057,70.8,566.35,46.0,53.6,46.6,MONITOR
39,"Most AI Models Would Run Your Company Into the Ground, Princeton’s CEO-Bench Finds",most-ai-models-would-run-your-company-into-the-ground-princeton-s-ceo-bench-finds,evergreen,864,0.057,70.8,566.35,46.0,51.9,46.2,MONITOR
40,"When An AI Agent Goes Rogue, Who Takes The Blame?",when-an-ai-agent-goes-rogue-who-takes-the-blame,evergreen,864,0.057,70.8,566.35,46.0,51.9,46.2,MONITOR
41,Working With AI: A concrete example,working-with-ai-a-concrete-example,evergreen,1080,0.05,69.2,553.5,41.0,48.8,48.2,MONITOR
42,Ornith-1.0: Self-scaffolding LLMs for agentic coding,ornith-1-0-self-scaffolding-llms-for-agentic-coding,evergreen,1044,0.05,66.9,535.05,41.0,49.8,51.8,MONITOR
43,AI-powered vibe coding is gaining ground in Nepal,ai-powered-vibe-coding-is-gaining-ground-in-nepal,evergreen,792,0.056,63.8,510.05,46.0,54.2,50.2,MONITOR
44,Agent Mode by Receiptor AI,agent-mode-by-receiptor-ai,evergreen,792,0.056,63.8,510.05,46.0,51.3,46.1,MONITOR
45,Import AI 447: The AGI economy; testing AIs with generated games; and agent ecologies,import-ai-447-the-agi-economy-testing-ais-with-generated-games-and-agent-ecologies,evergreen,792,0.056,63.8,510.05,46.0,51.3,45.9,MONITOR
46,The first big exit in AI,the-first-big-exit-in-ai,evergreen,792,0.056,63.8,510.05,46.0,51.3,45.9,MONITOR
47,Filum.ai,filum-ai,evergreen,792,0.056,63.8,510.05,46.0,51.6,45.3,MONITOR
48,Why Won't Europe Build AI Data Centers in Iceland?,why-won-t-europe-build-ai-data-centers-in-iceland,evergreen,990,0.05,63.4,507.38,41.0,48.4,47.1,MONITOR
49,SaaS stocks are rallying on AI optimism. 3 stocks to buy now.,saas-stocks-are-rallying-on-ai-optimism-3-stocks-to-buy-now,evergreen,864,0.053,58.7,469.37,41.0,27.2,38.9,MONITOR
50,Reco Launches Industry-First AI Agent Security to Tackle Agent Sprawl Across SaaS,reco-launches-industry-first-ai-agent-security-to-tackle-agent-sprawl-across-saas,news,1008,0.052,55.7,445.54,34.0,24.6,36.5,MONITOR
51,Import AI 445: Timing superintelligence; AIs solve frontier math proofs; a new ML research benchmark,import-ai-445-timing-superintelligence-ais-solve-frontier-math-proofs-a-new-ml-research-benchmark,evergreen,792,0.05,50.7,405.9,41.0,47.5,48.9,MONITOR
52,Import AI 454: Automating alignment research; safety study of a Chinese model; HiFloat4,import-ai-454-automating-alignment-research-safety-study-of-a-chinese-model-hifloat4,evergreen,792,0.05,50.7,405.9,41.0,47.5,48.9,MONITOR
53,AI Companies Will Become Profitable Eventually. Here's why.,ai-companies-will-become-profitable-eventually-here-s-why,evergreen,792,0.05,50.7,405.9,41.0,47.6,45.2,MONITOR
54,Ford rehires veteran engineers after AI fails to meet quality standards,ford-rehires-veteran-engineers-after-ai-fails-to-meet-quality-standards,evergreen,792,0.05,50.7,405.9,41.0,47.6,45.2,MONITOR
55,"Has AI changed the way you think, not just the way you work?",has-ai-changed-the-way-you-think-not-just-the-way-you-work,evergreen,792,0.05,50.7,405.9,41.0,47.6,45.2,MONITOR
56,"My AI Predictions, Two Years Later: The Ones That Landed",my-ai-predictions-two-years-later-the-ones-that-landed,evergreen,792,0.05,50.7,405.9,41.0,47.6,45.2,MONITOR
57,Palantir and Nvidia Expand Sovereign AI Partnership for US Government,palantir-and-nvidia-expand-sovereign-ai-partnership-for-us-government,evergreen,792,0.05,50.7,405.9,41.0,47.6,45.2,MONITOR
58,What AI capability do you think is still surprisingly underdeveloped?,what-ai-capability-do-you-think-is-still-surprisingly-underdeveloped,evergreen,792,0.05,50.7,405.9,41.0,47.6,45.2,MONITOR
59,What if AI's failures reveal our vices more than its limits?,what-if-ai-s-failures-reveal-our-vices-more-than-its-limits,evergreen,792,0.05,50.7,405.9,41.0,47.6,45.2,MONITOR
60,Working on my first fully featured Ai companion with Vision for games and movies n all that!,working-on-my-first-fully-featured-ai-companion-with-vision-for-games-and-movies-n-all-that,evergreen,792,0.05,50.7,405.9,41.0,47.6,45.2,MONITOR
61,A language model that runs on 5$ chip,a-language-model-that-runs-on-5-chip,evergreen,792,0.05,50.7,405.9,41.0,47.6,45.0,MONITOR
62,I built a benchmark for multi-turn prompt injection attacks. Most defenses never see them coming.,i-built-a-benchmark-for-multi-turn-prompt-injection-attacks-most-defenses-never-see-them-coming,evergreen,792,0.05,50.7,405.9,41.0,47.6,45.0,MONITOR
63,AI Slide Editor by CubeOne,ai-slide-editor-by-cubeone,evergreen,792,0.05,50.7,405.9,41.0,47.6,44.7,MONITOR
64,Tough Tongue AI for Sales,tough-tongue-ai-for-sales,evergreen,792,0.05,50.7,405.9,41.0,47.6,44.7,MONITOR
65,AI Is Automating Marketing Execution But Raising The Value Of Judgment,ai-is-automating-marketing-execution-but-raising-the-value-of-judgment,evergreen,792,0.05,50.7,405.9,41.0,47.5,44.5,MONITOR
66,"Hey Siri, meet AI",hey-siri-meet-ai,evergreen,792,0.05,50.7,405.9,41.0,47.5,44.5,MONITOR
67,Import AI 446: Nuclear LLMs; China's big AI benchmark; measurement and AI policy,import-ai-446-nuclear-llms-china-s-big-ai-benchmark-measurement-and-ai-policy,evergreen,792,0.05,50.7,405.9,41.0,47.5,44.5,MONITOR
68,Import AI 450: China's electronic warfare model; traumatized LLMs; and a scaling law for cyberattacks,import-ai-450-china-s-electronic-warfare-model-traumatized-llms-and-a-scaling-law-for-cyberattacks,evergreen,792,0.05,50.7,405.9,41.0,47.5,44.5,MONITOR
69,"Import AI 451: Political superintelligence; Google's society of minds, and a robot drummer",import-ai-451-political-superintelligence-google-s-society-of-minds-and-a-robot-drummer,evergreen,792,0.05,50.7,405.9,41.0,47.5,44.5,MONITOR
70,Import AI 456: RSI and economic growth; radical optionality for AI regulation; and a neural computer,import-ai-456-rsi-and-economic-growth-radical-optionality-for-ai-regulation-and-a-neural-computer,evergreen,792,0.05,50.7,405.9,41.0,47.5,44.5,MONITOR
71,Import AI 457: AI stuxnet; cursed Muon optimizer; and positive alignment,import-ai-457-ai-stuxnet-cursed-muon-optimizer-and-positive-alignment,evergreen,792,0.05,50.7,405.9,41.0,47.5,44.5,MONITOR
72,Import AI 458: Reckoning with the future; and a singularity story,import-ai-458-reckoning-with-the-future-and-a-singularity-story,evergreen,792,0.05,50.7,405.9,41.0,47.5,44.5,MONITOR
73,"Import AI 460: Reward hacking society, RSI data from Anthropic; and RL-based quadcopter racing",import-ai-460-reward-hacking-society-rsi-data-from-anthropic-and-rl-based-quadcopter-racing,evergreen,792,0.05,50.7,405.9,41.0,47.5,44.5,MONITOR
74,"Import AI 461: ""Alignment is not on track""; FrontierCode; and synthetic research interns",import-ai-461-alignment-is-not-on-track-frontiercode-and-synthetic-research-interns,evergreen,792,0.05,50.7,405.9,41.0,47.5,44.5,MONITOR
75,Import AI 462: Superpersuasion; self-sustaining AI; paths to ASI,import-ai-462-superpersuasion-self-sustaining-ai-paths-to-asi,evergreen,792,0.05,50.7,405.9,41.0,47.5,44.5,MONITOR
76,Import AI 463: Self-improving robots; a 10k Chinese GPU cluster; and an elegiac essay for the human era,import-ai-463-self-improving-robots-a-10k-chinese-gpu-cluster-and-an-elegiac-essay-for-the-human-era,evergreen,792,0.05,50.7,405.9,41.0,47.5,44.5,MONITOR
77,ImportAI 449: LLMs training other LLMs; 72B distributed training run; computer vision is harder than generative text,importai-449-llms-training-other-llms-72b-distributed-training-run-computer-vision-is-harder-than-generative-text,evergreen,792,0.05,50.7,405.9,41.0,47.5,44.5,MONITOR
78,Folio AI,folio-ai,evergreen,792,0.05,50.7,405.9,41.0,46.2,43.6,MONITOR
79,Oxlo.ai,oxlo-ai,evergreen,792,0.05,50.7,405.9,41.0,46.2,43.6,MONITOR
80,discode.ai,discode-ai,evergreen,792,0.05,50.7,405.9,41.0,46.2,43.6,MONITOR
81,BetterCloud Unveils AI-Native Next Generation SaaS Management Platform to Help Enterprises Govern AI at Scale,bettercloud-unveils-ai-native-next-generation-saas-management-platform-to-help-enterprises-govern-ai-at-scale,evergreen,864,0.052,47.7,381.89,34.0,46.4,42.0,MONITOR
82,Shopify launches AI-powered marketing automation tool,shopify-launches-ai-powered-marketing-automation-tool,news,864,0.05,45.9,367.2,34.0,27.9,40.7,MONITOR
83,ImageKit Launches Creative Automation with AI Assist to Help Teams Generate On-Brand Visuals at Scale,imagekit-launches-creative-automation-with-ai-assist-to-help-teams-generate-on-brand-visuals-at-scale,news,864,0.045,31.6,252.72,26.0,25.1,39.2,MONITOR
84,Asian AI startups launch Mythos-like models as Anthropic's export ban drags on,asian-ai-startups-launch-mythos-like-models-as-anthropic-s-export-ban-drags-on,news,792,0.033,16.3,130.68,16.0,15.7,34.0,MONITOR
