url,status,missing,og_title,og_description,og_image,twitter_card,twitter_image
/pricing/cursor/,PASS,,"Cursor Pricing Guide: Plans, Trial Notes, and Buying Risks","Cursor pricing research for AI Coding buyers. Review plan fit, hidden cost risks, alternatives, official pricing checks, and safe next steps before buying.",https://smileaireviewhub.com/assets/og/site.svg,summary_large_image,https://smileaireviewhub.com/assets/og/site.svg
/pricing/github-copilot/,PASS,,"GitHub Copilot Pricing Guide: Plans, Trial Notes, and Buying Risks","GitHub Copilot pricing research for AI Coding buyers. Review plan fit, hidden cost risks, alternatives, official pricing checks, and safe next steps before buying.",https://smileaireviewhub.com/assets/og/site.svg,summary_large_image,https://smileaireviewhub.com/assets/og/site.svg
/pricing/grammarly/,PASS,,"Grammarly Pricing Guide: Plans, Trial Notes, and Buying Risks","Grammarly pricing research for AI Writing buyers. Review plan fit, hidden cost risks, alternatives, official pricing checks, and safe next steps before buying.",https://smileaireviewhub.com/assets/og/site.svg,summary_large_image,https://smileaireviewhub.com/assets/og/site.svg
/pricing/,PASS,,Pricing Guides - MS Smile AI Review Hub,"Pricing research index for AI and SaaS tools, including plan fit, trial notes, hidden cost risk, and official verification.",https://smileaireviewhub.com/assets/og/site.svg,summary_large_image,https://smileaireviewhub.com/assets/og/site.svg
/pricing/mailchimp/,PASS,,"Mailchimp Pricing Guide: Plans, Trial Notes, and Buying Risks","Mailchimp pricing research for Email Marketing buyers. Review plan fit, hidden cost risks, alternatives, official pricing checks, and safe next steps before buying.",https://smileaireviewhub.com/assets/og/site.svg,summary_large_image,https://smileaireviewhub.com/assets/og/site.svg
/pricing/make/,PASS,,"Make Pricing Guide: Plans, Trial Notes, and Buying Risks","Make pricing research for Automation buyers. Review plan fit, hidden cost risks, alternatives, official pricing checks, and safe next steps before buying.",https://smileaireviewhub.com/assets/og/site.svg,summary_large_image,https://smileaireviewhub.com/assets/og/site.svg
/pricing/pictory/,PASS,,"Pictory Pricing Guide: Plans, Trial Notes, and Buying Risks","Pictory pricing research for AI Video buyers. Review plan fit, hidden cost risks, alternatives, official pricing checks, and safe next steps before buying.",https://smileaireviewhub.com/assets/og/site.svg,summary_large_image,https://smileaireviewhub.com/assets/og/site.svg
/pricing/semrush/,PASS,,"Semrush Pricing Guide: Plans, Trial Notes, and Buying Risks","Semrush pricing research for AI SEO buyers. Review plan fit, hidden cost risks, alternatives, official pricing checks, and safe next steps before buying.",https://smileaireviewhub.com/assets/og/site.svg,summary_large_image,https://smileaireviewhub.com/assets/og/site.svg
/pricing/zapier/,PASS,,"Zapier Pricing Guide: Plans, Trial Notes, and Buying Risks","Zapier pricing research for Automation buyers. Review plan fit, hidden cost risks, alternatives, official pricing checks, and safe next steps before buying.",https://smileaireviewhub.com/assets/og/site.svg,summary_large_image,https://smileaireviewhub.com/assets/og/site.svg
/privacy/,PASS,,Privacy Policy - MS Smile AI Review Hub,Privacy Policy for MS Smile AI Review Hub.,https://smileaireviewhub.com/assets/og/site.svg,summary_large_image,https://smileaireviewhub.com/assets/og/site.svg
/privacy-policy/,PASS,,Privacy Policy - MS Smile AI Review Hub,Privacy Policy for MS Smile AI Review Hub.,https://smileaireviewhub.com/assets/og/site.svg,summary_large_image,https://smileaireviewhub.com/assets/og/site.svg
/productivity-alternatives/,PASS,,Best Productivity Alternatives for 2026,"Editorial research guide for productivity alternatives. Compare realistic options, risks, official pricing checks, and tracking-safe next steps before choosing a tool.",https://smileaireviewhub.com/assets/og/site.svg,summary_large_image,https://smileaireviewhub.com/assets/og/site.svg
/reclaim-ai/,PASS,,"Reclaim AI Review: Features, Pros, Cons, Pricing Notes","Review nghiên cứu về Reclaim AI: workflow phù hợp, điểm mạnh, hạn chế, pricing note, alternatives, FAQ và affiliate disclosure.",https://smileaireviewhub.com/assets/og/reclaim-ai.svg,summary_large_image,https://smileaireviewhub.com/assets/og/reclaim-ai.svg
/review/activecampaign/,PASS,,"ActiveCampaign Review for Email Marketing Buyers: Workflow Fit, Pricing Checks, and Alternatives","ActiveCampaign review for Email Marketing buyers who need customer data workflow, campaign operations, reporting, and team adoption fit, realistic pricing research, alternatives, affiliate disclosure, and safe next steps before visiting the official site.",https://smileaireviewhub.com/assets/og/site.svg,summary_large_image,https://smileaireviewhub.com/assets/og/site.svg
/review/adcreative-ai/,PASS,,"AdCreative AI Review for Marketing Buyers: Workflow Fit, Pricing Checks, and Alternatives","AdCreative AI review for Marketing buyers who need customer data workflow, campaign operations, reporting, and team adoption fit, realistic pricing research, alternatives, affiliate disclosure, and safe next steps before visiting the official site.",https://smileaireviewhub.com/assets/og/site.svg,summary_large_image,https://smileaireviewhub.com/assets/og/site.svg
/review/canva/,PASS,,"Canva Review for AI Design Buyers: Workflow Fit, Pricing Checks, and Alternatives","Canva review for AI Design buyers who need creative output quality, editing control, commercial usage terms, and production workflow fit, realistic pricing research, alternatives, affiliate disclosure, and safe next steps before visiting the official site.",https://smileaireviewhub.com/assets/og/site.svg,summary_large_image,https://smileaireviewhub.com/assets/og/site.svg
/review/copy-ai/,PASS,,"Copy.ai Review for AI Writing Buyers: Workflow Fit, Pricing Checks, and Alternatives","Copy.ai review for AI Writing buyers who need workflow fit, pricing clarity, support expectations, and realistic alternatives, realistic pricing research, alternatives, affiliate disclosure, and safe next steps before visiting the official site.",https://smileaireviewhub.com/assets/og/site.svg,summary_large_image,https://smileaireviewhub.com/assets/og/site.svg
/review/cursor/,PASS,,"Cursor Review for AI Coding Buyers: Workflow Fit, Pricing Checks, and Alternatives","Cursor review for AI Coding buyers who need code editing support, repository context, and developer workflow fit, realistic pricing research, alternatives, affiliate disclosure, and safe next steps before visiting the official site.",https://smileaireviewhub.com/assets/og/site.svg,summary_large_image,https://smileaireviewhub.com/assets/og/site.svg
/review/descript/,PASS,,"Descript Review for AI Video Buyers: Workflow Fit, Pricing Checks, and Alternatives","Descript review for AI Video buyers who need creative output quality, editing control, commercial usage terms, and production workflow fit, realistic pricing research, alternatives, affiliate disclosure, and safe next steps before visiting the official site.",https://smileaireviewhub.com/assets/og/site.svg,summary_large_image,https://smileaireviewhub.com/assets/og/site.svg
/review/durable/,PASS,,"Durable Review for Website Builder Buyers: Workflow Fit, Pricing Checks, and Alternatives","Durable review for Website Builder buyers who need workflow fit, pricing clarity, support expectations, and realistic alternatives, realistic pricing research, alternatives, affiliate disclosure, and safe next steps before visiting the official site.",https://smileaireviewhub.com/assets/og/site.svg,summary_large_image,https://smileaireviewhub.com/assets/og/site.svg
/review/elevenlabs/,PASS,,"ElevenLabs Review for AI Voice Buyers: Workflow Fit, Pricing Checks, and Alternatives","ElevenLabs review for AI Voice buyers who need creative output quality, editing control, commercial usage terms, and production workflow fit, realistic pricing research, alternatives, affiliate disclosure, and safe next steps before visiting the official site.",https://smileaireviewhub.com/assets/og/site.svg,summary_large_image,https://smileaireviewhub.com/assets/og/site.svg
/review/framer/,PASS,,"Framer Review for Website Builder Buyers: Workflow Fit, Pricing Checks, and Alternatives","Framer review for Website Builder buyers who need workflow fit, pricing clarity, support expectations, and realistic alternatives, realistic pricing research, alternatives, affiliate disclosure, and safe next steps before visiting the official site.",https://smileaireviewhub.com/assets/og/site.svg,summary_large_image,https://smileaireviewhub.com/assets/og/site.svg
/review/gamma/,PASS,,"Gamma Review for AI Productivity Buyers: Workflow Fit, Pricing Checks, and Alternatives","Gamma review for AI Productivity buyers who need workflow fit, pricing clarity, support expectations, and realistic alternatives, realistic pricing research, alternatives, affiliate disclosure, and safe next steps before visiting the official site.",https://smileaireviewhub.com/assets/og/site.svg,summary_large_image,https://smileaireviewhub.com/assets/og/site.svg
/review/github-copilot/,PASS,,"GitHub Copilot Review for AI Coding Buyers: Workflow Fit, Pricing Checks, and Alternatives","GitHub Copilot review for AI Coding buyers who need code editing support, repository context, and developer workflow fit, realistic pricing research, alternatives, affiliate disclosure, and safe next steps before visiting the official site.",https://smileaireviewhub.com/assets/og/site.svg,summary_large_image,https://smileaireviewhub.com/assets/og/site.svg
/review/hubspot/,PASS,,"HubSpot Review for CRM Buyers: Workflow Fit, Pricing Checks, and Alternatives","HubSpot review for CRM buyers who need customer data workflow, campaign operations, reporting, and team adoption fit, realistic pricing research, alternatives, affiliate disclosure, and safe next steps before visiting the official site.",https://smileaireviewhub.com/assets/og/site.svg,summary_large_image,https://smileaireviewhub.com/assets/og/site.svg
/review/jasper/,PASS,,"Jasper Review for AI Writing Buyers: Workflow Fit, Pricing Checks, and Alternatives","Jasper review for AI Writing buyers who need workflow fit, pricing clarity, support expectations, and realistic alternatives, realistic pricing research, alternatives, affiliate disclosure, and safe next steps before visiting the official site.",https://smileaireviewhub.com/assets/og/site.svg,summary_large_image,https://smileaireviewhub.com/assets/og/site.svg
/review/jasper-ai/,PASS,,"Jasper AI Review for AI Writing Buyers: Workflow Fit, Pricing Checks, and Alternatives","Jasper AI review for AI Writing buyers who need workflow fit, pricing clarity, support expectations, and realistic alternatives, realistic pricing research, alternatives, affiliate disclosure, and safe next steps before visiting the official site.",https://smileaireviewhub.com/assets/og/site.svg,summary_large_image,https://smileaireviewhub.com/assets/og/site.svg
/review/make/,PASS,,"Make Review for Automation Buyers: Workflow Fit, Pricing Checks, and Alternatives","Make review for Automation buyers who need workflow automation logic, app connections, error handling, and maintenance cost, realistic pricing research, alternatives, affiliate disclosure, and safe next steps before visiting the official site.",https://smileaireviewhub.com/assets/og/site.svg,summary_large_image,https://smileaireviewhub.com/assets/og/site.svg
/review/notion/,PASS,,"Notion Review for Productivity Buyers: Workflow Fit, Pricing Checks, and Alternatives","Notion review for Productivity buyers who need workflow fit, pricing clarity, support expectations, and realistic alternatives, realistic pricing research, alternatives, affiliate disclosure, and safe next steps before visiting the official site.",https://smileaireviewhub.com/assets/og/site.svg,summary_large_image,https://smileaireviewhub.com/assets/og/site.svg
/review/notion-ai/,PASS,,"Notion AI Review for AI Productivity Buyers: Workflow Fit, Pricing Checks, and Alternatives","Notion AI review for AI Productivity buyers who need workflow fit, pricing clarity, support expectations, and realistic alternatives, realistic pricing research, alternatives, affiliate disclosure, and safe next steps before visiting the official site.",https://smileaireviewhub.com/assets/og/site.svg,summary_large_image,https://smileaireviewhub.com/assets/og/site.svg
/review/pipedrive/,PASS,,"Pipedrive Review for CRM Buyers: Workflow Fit, Pricing Checks, and Alternatives","Pipedrive review for CRM buyers who need customer data workflow, campaign operations, reporting, and team adoption fit, realistic pricing research, alternatives, affiliate disclosure, and safe next steps before visiting the official site.",https://smileaireviewhub.com/assets/og/site.svg,summary_large_image,https://smileaireviewhub.com/assets/og/site.svg
/review/pipedrive-crm/,PASS,,"Pipedrive CRM Review for CRM Buyers: Workflow Fit, Pricing Checks, and Alternatives","Pipedrive CRM review for CRM buyers who need customer data workflow, campaign operations, reporting, and team adoption fit, realistic pricing research, alternatives, affiliate disclosure, and safe next steps before visiting the official site.",https://smileaireviewhub.com/assets/og/site.svg,summary_large_image,https://smileaireviewhub.com/assets/og/site.svg
/review/reclaim-ai/,PASS,,"Reclaim AI Review for AI Meeting Buyers: Workflow Fit, Pricing Checks, and Alternatives","Reclaim AI review for AI Meeting buyers who need workflow fit, pricing clarity, support expectations, and realistic alternatives, realistic pricing research, alternatives, affiliate disclosure, and safe next steps before visiting the official site.",https://smileaireviewhub.com/assets/og/site.svg,summary_large_image,https://smileaireviewhub.com/assets/og/site.svg
/review/runway/,PASS,,"Runway Review for AI Video Buyers: Workflow Fit, Pricing Checks, and Alternatives","Runway review for AI Video buyers who need creative output quality, editing control, commercial usage terms, and production workflow fit, realistic pricing research, alternatives, affiliate disclosure, and safe next steps before visiting the official site.",https://smileaireviewhub.com/assets/og/site.svg,summary_large_image,https://smileaireviewhub.com/assets/og/site.svg
/review/semrush/,PASS,,"Semrush Review for AI SEO Buyers: Workflow Fit, Pricing Checks, and Alternatives","Semrush review for AI SEO buyers who need keyword research, content planning, competitor checks, and reporting workflow fit, realistic pricing research, alternatives, affiliate disclosure, and safe next steps before visiting the official site.",https://smileaireviewhub.com/assets/og/site.svg,summary_large_image,https://smileaireviewhub.com/assets/og/site.svg
/review/surfer-seo/,PASS,,"Surfer SEO Review for AI SEO Buyers: Workflow Fit, Pricing Checks, and Alternatives","Surfer SEO review for AI SEO buyers who need keyword research, content planning, competitor checks, and reporting workflow fit, realistic pricing research, alternatives, affiliate disclosure, and safe next steps before visiting the official site.",https://smileaireviewhub.com/assets/og/site.svg,summary_large_image,https://smileaireviewhub.com/assets/og/site.svg
/review/synthesia/,PASS,,"Synthesia Review for AI Video Buyers: Workflow Fit, Pricing Checks, and Alternatives","Synthesia review for AI Video buyers who need creative output quality, editing control, commercial usage terms, and production workflow fit, realistic pricing research, alternatives, affiliate disclosure, and safe next steps before visiting the official site.",https://smileaireviewhub.com/assets/og/site.svg,summary_large_image,https://smileaireviewhub.com/assets/og/site.svg
/review/webflow/,PASS,,"Webflow Review for Website Builder Buyers: Workflow Fit, Pricing Checks, and Alternatives","Webflow review for Website Builder buyers who need workflow fit, pricing clarity, support expectations, and realistic alternatives, realistic pricing research, alternatives, affiliate disclosure, and safe next steps before visiting the official site.",https://smileaireviewhub.com/assets/og/site.svg,summary_large_image,https://smileaireviewhub.com/assets/og/site.svg
/review/webflow-ai/,PASS,,"Webflow AI Review for Website Builder Buyers: Workflow Fit, Pricing Checks, and Alternatives","Webflow AI review for Website Builder buyers who need workflow fit, pricing clarity, support expectations, and realistic alternatives, realistic pricing research, alternatives, affiliate disclosure, and safe next steps before visiting the official site.",https://smileaireviewhub.com/assets/og/site.svg,summary_large_image,https://smileaireviewhub.com/assets/og/site.svg
/review/zapier/,PASS,,"Zapier Review for Automation Buyers: Workflow Fit, Pricing Checks, and Alternatives","Zapier review for Automation buyers who need workflow automation logic, app connections, error handling, and maintenance cost, realistic pricing research, alternatives, affiliate disclosure, and safe next steps before visiting the official site.",https://smileaireviewhub.com/assets/og/site.svg,summary_large_image,https://smileaireviewhub.com/assets/og/site.svg
/reviews/,PASS,,Reviews - MS Smile AI Review Hub,"Browse AI and SaaS reviews by product, category, score, and risk level.",https://smileaireviewhub.com/assets/og/site.svg,summary_large_image,https://smileaireviewhub.com/assets/og/site.svg
/runway/,PASS,,"Runway Review: Features, Pros, Cons, Pricing Notes","Review nghiên cứu về Runway: workflow phù hợp, điểm mạnh, hạn chế, pricing note, alternatives, FAQ và affiliate disclosure.",https://smileaireviewhub.com/assets/og/runway.svg,summary_large_image,https://smileaireviewhub.com/assets/og/runway.svg
/semrush/,PASS,,"Semrush Review: Features, Pros, Cons, Pricing Notes","Review nghiên cứu về Semrush: workflow phù hợp, điểm mạnh, hạn chế, pricing note, alternatives, FAQ và affiliate disclosure.",https://smileaireviewhub.com/assets/og/semrush.svg,summary_large_image,https://smileaireviewhub.com/assets/og/semrush.svg
/semrush-pricing/,PASS,,Giá Semrush: những điểm cần kiểm tra trước khi mua,"Hướng dẫn nghiên cứu về giá Semrush. Pricing có thể thay đổi, nên cần xác minh plan hiện tại, giới hạn sử dụng, điều khoản hủy, alternatives và policy chính thức.",https://smileaireviewhub.com/assets/og/site.svg,summary_large_image,https://smileaireviewhub.com/assets/og/site.svg
/sitemap/,PASS,,Sitemap - MS Smile AI Review Hub,Human-readable sitemap for AI Tool Review Hub.,https://smileaireviewhub.com/assets/og/site.svg,summary_large_image,https://smileaireviewhub.com/assets/og/site.svg
/surfer-seo/,PASS,,"Surfer SEO Review: Features, Pros, Cons, Pricing Notes","Review nghiên cứu về Surfer SEO: workflow phù hợp, điểm mạnh, hạn chế, pricing note, alternatives, FAQ và affiliate disclosure.",https://smileaireviewhub.com/assets/og/surfer-seo.svg,summary_large_image,https://smileaireviewhub.com/assets/og/surfer-seo.svg
/surfer-seo-pricing/,PASS,,Giá Surfer SEO: những điểm cần kiểm tra trước khi mua,"Hướng dẫn nghiên cứu về giá Surfer SEO. Pricing có thể thay đổi, nên cần xác minh plan hiện tại, giới hạn sử dụng, điều khoản hủy, alternatives và policy chính thức.",https://smileaireviewhub.com/assets/og/site.svg,summary_large_image,https://smileaireviewhub.com/assets/og/site.svg
/synthesia/,PASS,,"Synthesia Review: Features, Pros, Cons, Pricing Notes","Review nghiên cứu về Synthesia: workflow phù hợp, điểm mạnh, hạn chế, pricing note, alternatives, FAQ và affiliate disclosure.",https://smileaireviewhub.com/assets/og/synthesia.svg,summary_large_image,https://smileaireviewhub.com/assets/og/synthesia.svg
/terms/,PASS,,Terms - MS Smile AI Review Hub,Terms for MS Smile AI Review Hub.,https://smileaireviewhub.com/assets/og/site.svg,summary_large_image,https://smileaireviewhub.com/assets/og/site.svg
/testing-methodology/,PASS,,Testing Methodology - MS Smile AI Review Hub,Testing Methodology for AI Tool Review Hub.,https://smileaireviewhub.com/assets/og/site.svg,summary_large_image,https://smileaireviewhub.com/assets/og/site.svg
/webflow/,PASS,,"Webflow Review: Features, Pros, Cons, Pricing Notes","Review nghiên cứu về Webflow: workflow phù hợp, điểm mạnh, hạn chế, pricing note, alternatives, FAQ và affiliate disclosure.",https://smileaireviewhub.com/assets/og/webflow.svg,summary_large_image,https://smileaireviewhub.com/assets/og/webflow.svg
/webflow-ai/,PASS,,"Webflow AI Review: Features, Pros, Cons, Pricing Notes","Review nghiên cứu về Webflow AI: workflow phù hợp, điểm mạnh, hạn chế, pricing note, alternatives, FAQ và affiliate disclosure.",https://smileaireviewhub.com/assets/og/webflow-ai.svg,summary_large_image,https://smileaireviewhub.com/assets/og/webflow-ai.svg
/website-builder-alternatives/,PASS,,Best Website Builder Alternatives for 2026,"Editorial research guide for website builder alternatives. Compare realistic options, risks, official pricing checks, and tracking-safe next steps before choosing a tool.",https://smileaireviewhub.com/assets/og/site.svg,summary_large_image,https://smileaireviewhub.com/assets/og/site.svg
/website-builder-software-review/,PASS,,Website Builder Software Review: Research-Style Review for 2026,"Editorial research guide for website builder software review. Compare realistic options, risks, official pricing checks, and tracking-safe next steps before choosing a tool.",https://smileaireviewhub.com/assets/og/site.svg,summary_large_image,https://smileaireviewhub.com/assets/og/site.svg
/windsurf-review/,PASS,,"Windsurf Review: Agent-Style AI Coding Workflow, Pros, Cons, and Alternatives","Windsurf review for AI coding buyers: workflow fit, pros and cons, pricing research, best use cases, who should avoid it, alternatives, FAQ, and tracked CTAs.",https://smileaireviewhub.com/assets/og/site.svg,summary_large_image,https://smileaireviewhub.com/assets/og/site.svg
/zapier/,PASS,,"Zapier Review: Features, Pros, Cons, Pricing Notes","Review nghiên cứu về Zapier: workflow phù hợp, điểm mạnh, hạn chế, pricing note, alternatives, FAQ và affiliate disclosure.",https://smileaireviewhub.com/assets/og/zapier.svg,summary_large_image,https://smileaireviewhub.com/assets/og/zapier.svg
/zapier-pricing/,PASS,,Giá Zapier: những điểm cần kiểm tra trước khi mua,"Hướng dẫn nghiên cứu về giá Zapier. Pricing có thể thay đổi, nên cần xác minh plan hiện tại, giới hạn sử dụng, điều khoản hủy, alternatives và policy chính thức.",https://smileaireviewhub.com/assets/og/site.svg,summary_large_image,https://smileaireviewhub.com/assets/og/site.svg
