url,status,missing,og_title,og_description,og_image,twitter_card,twitter_image
/compare/make-vs-zapier/,PASS,,Make vs Zapier: Which automation platforms should you choose?,"Research-style comparison of Make vs Zapier for automation platforms buyers. Compare strengths, weaknesses, pricing checks, reviews, tracking CTAs, and safer buying considerations.",https://smileaireviewhub.com/assets/og/site.svg,summary_large_image,https://smileaireviewhub.com/assets/og/site.svg
/compare/semrush-vs-ahrefs/,PASS,,Semrush vs Ahrefs: Which SEO platforms should you choose?,"Research-style comparison of Semrush vs Ahrefs for SEO platforms buyers. Compare strengths, weaknesses, pricing checks, reviews, tracking CTAs, and safer buying considerations.",https://smileaireviewhub.com/assets/og/site.svg,summary_large_image,https://smileaireviewhub.com/assets/og/site.svg
/compare/synthesia-vs-pictory/,PASS,,Synthesia vs Pictory: Which AI video tools should you choose?,"Research-style comparison of Synthesia vs Pictory for AI video tools buyers. Compare strengths, weaknesses, pricing checks, reviews, tracking CTAs, and safer buying considerations.",https://smileaireviewhub.com/assets/og/site.svg,summary_large_image,https://smileaireviewhub.com/assets/og/site.svg
/comparisons/canva-vs-adobe-express/,PASS,,Canva vs Adobe Express: Which Tool Should You Choose in 2026?,"Compare Canva vs Adobe Express for design and marketing content, including strengths, weaknesses, pricing checks, best use cases, alternatives, and affiliate-safe next steps.",https://smileaireviewhub.com/assets/og/site.svg,summary_large_image,https://smileaireviewhub.com/assets/og/site.svg
/comparisons/canva-vs-gamma/,PASS,,Canva vs Gamma: Which AI design and presentation tools should you choose?,"Research-style comparison of Canva vs Gamma: features, best use cases, pricing notes, alternatives, FAQ, and affiliate disclosure.",https://smileaireviewhub.com/assets/og/site.svg,summary_large_image,https://smileaireviewhub.com/assets/og/site.svg
/comparisons/chatgpt-vs-claude/,PASS,,ChatGPT vs Claude: Which AI assistants should you choose?,"Research-style comparison of ChatGPT vs Claude: features, best use cases, pricing notes, alternatives, FAQ, and affiliate disclosure.",https://smileaireviewhub.com/assets/og/site.svg,summary_large_image,https://smileaireviewhub.com/assets/og/site.svg
/comparisons/chatgpt-vs-gemini/,PASS,,ChatGPT vs Gemini - MS Smile AI Review Hub,"So sánh ChatGPT vs Gemini: overview, feature comparison, pricing, best for, pros/cons, FAQ và khuyến nghị cuối.",https://smileaireviewhub.com/assets/og/site.svg,summary_large_image,https://smileaireviewhub.com/assets/og/site.svg
/comparisons/copilot-vs-cursor/,PASS,,Copilot vs Cursor: Enterprise Assistant or AI-First Coding Editor?,"Compare GitHub Copilot vs Cursor for AI coding: enterprise fit, context awareness, autocomplete speed, multi-file editing, pricing risk, pros and cons, and alternatives.",https://smileaireviewhub.com/assets/og/site.svg,summary_large_image,https://smileaireviewhub.com/assets/og/site.svg
/comparisons/copilot-vs-tabnine/,PASS,,GitHub Copilot vs Tabnine - MS Smile AI Review Hub,"So sánh GitHub Copilot vs Tabnine: overview, feature comparison, pricing, best for, pros/cons, FAQ và khuyến nghị cuối.",https://smileaireviewhub.com/assets/og/site.svg,summary_large_image,https://smileaireviewhub.com/assets/og/site.svg
/comparisons/cursor-vs-copilot/,PASS,,Cursor vs GitHub Copilot: Which Tool Should You Choose in 2026?,"Compare Cursor vs GitHub Copilot for AI coding workflow, including strengths, weaknesses, pricing checks, best use cases, alternatives, and affiliate-safe next steps.",https://smileaireviewhub.com/assets/og/site.svg,summary_large_image,https://smileaireviewhub.com/assets/og/site.svg
/comparisons/cursor-vs-github-copilot/,PASS,,Cursor vs GitHub Copilot: Which AI coding tools should you choose?,"Research-style comparison of Cursor vs GitHub Copilot: features, best use cases, pricing notes, alternatives, FAQ, and affiliate disclosure.",https://smileaireviewhub.com/assets/og/site.svg,summary_large_image,https://smileaireviewhub.com/assets/og/site.svg
/comparisons/cursor-vs-vscode/,PASS,,Cursor vs VS Code - MS Smile AI Review Hub,"So sánh Cursor vs VS Code: overview, feature comparison, pricing, best for, pros/cons, FAQ và khuyến nghị cuối.",https://smileaireviewhub.com/assets/og/site.svg,summary_large_image,https://smileaireviewhub.com/assets/og/site.svg
/comparisons/cursor-vs-windsurf/,PASS,,Cursor vs Windsurf: Which AI Coding Editor Fits Real Development Work?,"Cursor vs Windsurf comparison for AI coding workflows, context awareness, autocomplete speed, multi-file editing, pricing risk, pros and cons, alternatives, and safe CTAs.",https://smileaireviewhub.com/assets/og/site.svg,summary_large_image,https://smileaireviewhub.com/assets/og/site.svg
/comparisons/elevenlabs-vs-murf/,PASS,,ElevenLabs vs Murf: Which AI voice tools should you choose?,"Research-style comparison of ElevenLabs vs Murf: features, best use cases, pricing notes, alternatives, FAQ, and affiliate disclosure.",https://smileaireviewhub.com/assets/og/site.svg,summary_large_image,https://smileaireviewhub.com/assets/og/site.svg
/comparisons/elevenlabs-vs-playht/,PASS,,ElevenLabs vs PlayHT - MS Smile AI Review Hub,"So sánh ElevenLabs vs PlayHT: overview, feature comparison, pricing, best for, pros/cons, FAQ và khuyến nghị cuối.",https://smileaireviewhub.com/assets/og/site.svg,summary_large_image,https://smileaireviewhub.com/assets/og/site.svg
/comparisons/framer-vs-webflow/,PASS,,Framer vs Webflow - MS Smile AI Review Hub,"So sánh Framer vs Webflow: overview, feature comparison, pricing, best for, pros/cons, FAQ và khuyến nghị cuối.",https://smileaireviewhub.com/assets/og/site.svg,summary_large_image,https://smileaireviewhub.com/assets/og/site.svg
/comparisons/gemini-vs-claude/,PASS,,Gemini vs Claude - MS Smile AI Review Hub,"So sánh Gemini vs Claude: overview, feature comparison, pricing, best for, pros/cons, FAQ và khuyến nghị cuối.",https://smileaireviewhub.com/assets/og/site.svg,summary_large_image,https://smileaireviewhub.com/assets/og/site.svg
/comparisons/hubspot-vs-salesforce/,PASS,,HubSpot vs Salesforce - MS Smile AI Review Hub,"So sánh HubSpot vs Salesforce: overview, feature comparison, pricing, best for, pros/cons, FAQ và khuyến nghị cuối.",https://smileaireviewhub.com/assets/og/site.svg,summary_large_image,https://smileaireviewhub.com/assets/og/site.svg
/comparisons/,PASS,,Comparisons - MS Smile AI Review Hub,"Compare AI and SaaS tools by category, score, risk, and research notes.",https://smileaireviewhub.com/assets/og/site.svg,summary_large_image,https://smileaireviewhub.com/assets/og/site.svg
/comparisons/jasper-vs-copyai/,PASS,,Jasper vs Copy.ai - MS Smile AI Review Hub,"So sánh Jasper vs Copy.ai: overview, feature comparison, pricing, best for, pros/cons, FAQ và khuyến nghị cuối.",https://smileaireviewhub.com/assets/og/site.svg,summary_large_image,https://smileaireviewhub.com/assets/og/site.svg
/comparisons/make-vs-zapier/,PASS,,Make vs Zapier: Which automation platforms should you choose?,"Research-style comparison of Make vs Zapier: features, best use cases, pricing notes, alternatives, FAQ, and affiliate disclosure.",https://smileaireviewhub.com/assets/og/site.svg,summary_large_image,https://smileaireviewhub.com/assets/og/site.svg
/comparisons/midjourney-vs-dalle/,PASS,,Midjourney vs DALL-E - MS Smile AI Review Hub,"So sánh Midjourney vs DALL-E: overview, feature comparison, pricing, best for, pros/cons, FAQ và khuyến nghị cuối.",https://smileaireviewhub.com/assets/og/site.svg,summary_large_image,https://smileaireviewhub.com/assets/og/site.svg
/comparisons/notion-ai-vs-chatgpt/,PASS,,Notion AI vs ChatGPT - MS Smile AI Review Hub,"So sánh Notion AI vs ChatGPT: overview, feature comparison, pricing, best for, pros/cons, FAQ và khuyến nghị cuối.",https://smileaireviewhub.com/assets/og/site.svg,summary_large_image,https://smileaireviewhub.com/assets/og/site.svg
/comparisons/notion-ai-vs-clickup-ai/,PASS,,Notion AI vs ClickUp AI: Which AI productivity tools should you choose?,"Research-style comparison of Notion AI vs ClickUp AI: features, best use cases, pricing notes, alternatives, FAQ, and affiliate disclosure.",https://smileaireviewhub.com/assets/og/site.svg,summary_large_image,https://smileaireviewhub.com/assets/og/site.svg
/comparisons/notion-vs-clickup/,PASS,,Notion vs ClickUp - MS Smile AI Review Hub,"So sánh Notion vs ClickUp: overview, feature comparison, pricing, best for, pros/cons, FAQ và khuyến nghị cuối.",https://smileaireviewhub.com/assets/og/site.svg,summary_large_image,https://smileaireviewhub.com/assets/og/site.svg
/comparisons/perplexity-vs-chatgpt/,PASS,,Perplexity vs ChatGPT - MS Smile AI Review Hub,"So sánh Perplexity vs ChatGPT: overview, feature comparison, pricing, best for, pros/cons, FAQ và khuyến nghị cuối.",https://smileaireviewhub.com/assets/og/site.svg,summary_large_image,https://smileaireviewhub.com/assets/og/site.svg
/comparisons/runway-vs-pika/,PASS,,Runway vs Pika: Which AI video tools should you choose?,"Research-style comparison of Runway vs Pika: features, best use cases, pricing notes, alternatives, FAQ, and affiliate disclosure.",https://smileaireviewhub.com/assets/og/site.svg,summary_large_image,https://smileaireviewhub.com/assets/og/site.svg
/comparisons/semrush-vs-ahrefs/,PASS,,Semrush vs Ahrefs: Which SEO platforms should you choose?,"Research-style comparison of Semrush vs Ahrefs: features, best use cases, pricing notes, alternatives, FAQ, and affiliate disclosure.",https://smileaireviewhub.com/assets/og/site.svg,summary_large_image,https://smileaireviewhub.com/assets/og/site.svg
/comparisons/synthesia-vs-heygen/,PASS,,Synthesia vs HeyGen - MS Smile AI Review Hub,"So sánh Synthesia vs HeyGen: overview, feature comparison, pricing, best for, pros/cons, FAQ và khuyến nghị cuối.",https://smileaireviewhub.com/assets/og/site.svg,summary_large_image,https://smileaireviewhub.com/assets/og/site.svg
/comparisons/windsurf-vs-copilot/,PASS,,Windsurf vs GitHub Copilot: Which Tool Should You Choose in 2026?,"Compare Windsurf vs GitHub Copilot for agentic coding versus autocomplete, including strengths, weaknesses, pricing checks, best use cases, alternatives, and affiliate-safe next steps.",https://smileaireviewhub.com/assets/og/site.svg,summary_large_image,https://smileaireviewhub.com/assets/og/site.svg
/contact/,PASS,,Contact - MS Smile AI Review Hub,Contact for MS Smile AI Review Hub.,https://smileaireviewhub.com/assets/og/site.svg,summary_large_image,https://smileaireviewhub.com/assets/og/site.svg
/copy-ai/,PASS,,"Copy.ai Review: Features, Pros, Cons, Pricing Notes","Review nghiên cứu về Copy.ai: workflow phù hợp, điểm mạnh, hạn chế, pricing note, alternatives, FAQ và affiliate disclosure.",https://smileaireviewhub.com/assets/og/copy-ai.svg,summary_large_image,https://smileaireviewhub.com/assets/og/copy-ai.svg
/crm-alternatives/,PASS,,Best CRM Alternatives for 2026,"Editorial research guide for crm alternatives. Compare realistic options, risks, official pricing checks, and tracking-safe next steps before choosing a tool.",https://smileaireviewhub.com/assets/og/site.svg,summary_large_image,https://smileaireviewhub.com/assets/og/site.svg
/cursor/,PASS,,"Cursor Review: Features, Pros, Cons, Pricing Notes","Review nghiên cứu về Cursor: workflow phù hợp, điểm mạnh, hạn chế, pricing note, alternatives, FAQ và affiliate disclosure.",https://smileaireviewhub.com/assets/og/cursor.svg,summary_large_image,https://smileaireviewhub.com/assets/og/cursor.svg
/cursor-ai-review-a-practical-guide-for-developers-and-ai-coders/,PASS,,Cursor Ai Review: A Practical Guide for Developers And Ai Coders - AI Tool Review Hub,Approved draft page for cursor ai review.,https://smileaireviewhub.com/assets/og/site.svg,summary_large_image,https://smileaireviewhub.com/assets/og/site.svg
/cursor-pricing/,PASS,,Giá Cursor: những điểm cần kiểm tra trước khi mua,"Hướng dẫn nghiên cứu về giá Cursor. Pricing có thể thay đổi, nên cần xác minh plan hiện tại, giới hạn sử dụng, điều khoản hủy, alternatives và policy chính thức.",https://smileaireviewhub.com/assets/og/site.svg,summary_large_image,https://smileaireviewhub.com/assets/og/site.svg
/descript/,PASS,,"Descript Review: Features, Pros, Cons, Pricing Notes","Review nghiên cứu về Descript: workflow phù hợp, điểm mạnh, hạn chế, pricing note, alternatives, FAQ và affiliate disclosure.",https://smileaireviewhub.com/assets/og/descript.svg,summary_large_image,https://smileaireviewhub.com/assets/og/descript.svg
/disclosure/,PASS,,Disclosure - MS Smile AI Review Hub,Disclosure for MS Smile AI Review Hub.,https://smileaireviewhub.com/assets/og/site.svg,summary_large_image,https://smileaireviewhub.com/assets/og/site.svg
/durable/,PASS,,"Durable Review: Features, Pros, Cons, Pricing Notes","Review nghiên cứu về Durable: workflow phù hợp, điểm mạnh, hạn chế, pricing note, alternatives, FAQ và affiliate disclosure.",https://smileaireviewhub.com/assets/og/durable.svg,summary_large_image,https://smileaireviewhub.com/assets/og/durable.svg
/editorial-policy/,PASS,,Editorial Policy - MS Smile AI Review Hub,Editorial Policy for AI Tool Review Hub.,https://smileaireviewhub.com/assets/og/site.svg,summary_large_image,https://smileaireviewhub.com/assets/og/site.svg
/elevenlabs/,PASS,,"ElevenLabs Review: Features, Pros, Cons, Pricing Notes","Review nghiên cứu về ElevenLabs: workflow phù hợp, điểm mạnh, hạn chế, pricing note, alternatives, FAQ và affiliate disclosure.",https://smileaireviewhub.com/assets/og/elevenlabs.svg,summary_large_image,https://smileaireviewhub.com/assets/og/elevenlabs.svg
/elevenlabs-pricing/,PASS,,Giá ElevenLabs: những điểm cần kiểm tra trước khi mua,"Hướng dẫn nghiên cứu về giá ElevenLabs. Pricing có thể thay đổi, nên cần xác minh plan hiện tại, giới hạn sử dụng, điều khoản hủy, alternatives và policy chính thức.",https://smileaireviewhub.com/assets/og/site.svg,summary_large_image,https://smileaireviewhub.com/assets/og/site.svg
/email-marketing-alternatives/,PASS,,Best Email Marketing Alternatives for 2026,"Editorial research guide for email marketing alternatives. Compare realistic options, risks, official pricing checks, and tracking-safe next steps before choosing a tool.",https://smileaireviewhub.com/assets/og/site.svg,summary_large_image,https://smileaireviewhub.com/assets/og/site.svg
/email-marketing-software-review/,PASS,,Email Marketing Software Review: Research-Style Review for 2026,"Editorial research guide for email marketing software review. Compare realistic options, risks, official pricing checks, and tracking-safe next steps before choosing a tool.",https://smileaireviewhub.com/assets/og/site.svg,summary_large_image,https://smileaireviewhub.com/assets/og/site.svg
/framer/,PASS,,"Framer Review: Features, Pros, Cons, Pricing Notes","Review nghiên cứu về Framer: workflow phù hợp, điểm mạnh, hạn chế, pricing note, alternatives, FAQ và affiliate disclosure.",https://smileaireviewhub.com/assets/og/framer.svg,summary_large_image,https://smileaireviewhub.com/assets/og/framer.svg
/gamma/,PASS,,"Gamma Review: Features, Pros, Cons, Pricing Notes","Review nghiên cứu về Gamma: workflow phù hợp, điểm mạnh, hạn chế, pricing note, alternatives, FAQ và affiliate disclosure.",https://smileaireviewhub.com/assets/og/gamma.svg,summary_large_image,https://smileaireviewhub.com/assets/og/gamma.svg
/github-copilot/,PASS,,"GitHub Copilot Review: Features, Pros, Cons, Pricing Notes","Review nghiên cứu về GitHub Copilot: workflow phù hợp, điểm mạnh, hạn chế, pricing note, alternatives, FAQ và affiliate disclosure.",https://smileaireviewhub.com/assets/og/github-copilot.svg,summary_large_image,https://smileaireviewhub.com/assets/og/github-copilot.svg
/github-copilot-pricing/,PASS,,Giá GitHub Copilot: những điểm cần kiểm tra trước khi mua,"Hướng dẫn nghiên cứu về giá GitHub Copilot. Pricing có thể thay đổi, nên cần xác minh plan hiện tại, giới hạn sử dụng, điều khoản hủy, alternatives và policy chính thức.",https://smileaireviewhub.com/assets/og/site.svg,summary_large_image,https://smileaireviewhub.com/assets/og/site.svg
/how-we-review-tools/,PASS,,How We Review Tools - MS Smile AI Review Hub,How We Review Tools for AI Tool Review Hub.,https://smileaireviewhub.com/assets/og/site.svg,summary_large_image,https://smileaireviewhub.com/assets/og/site.svg
/hub/ai-automation/,PASS,,AI Automation Tools Hub,"Research hub for automation tools, no-code workflows, app connectors, and operational productivity systems.",https://smileaireviewhub.com/assets/og/site.svg,summary_large_image,https://smileaireviewhub.com/assets/og/site.svg
/hub/ai-coding/,PASS,,AI Coding Tools Hub,"Research hub for AI coding tools, coding assistants, developer workflows, pricing pages, and comparison content.",https://smileaireviewhub.com/assets/og/site.svg,summary_large_image,https://smileaireviewhub.com/assets/og/site.svg
/hub/ai-presentation/,PASS,,AI Presentation Tools Hub,"Research hub for AI presentation tools, deck builders, visual storytelling, and design-assisted content workflows.",https://smileaireviewhub.com/assets/og/site.svg,summary_large_image,https://smileaireviewhub.com/assets/og/site.svg
/hub/ai-seo/,PASS,,AI SEO Tools Hub,"Research hub for SEO platforms, AI SEO workflows, content optimization tools, keyword research, and competitor analysis.",https://smileaireviewhub.com/assets/og/site.svg,summary_large_image,https://smileaireviewhub.com/assets/og/site.svg
/hub/ai-video/,PASS,,AI Video Tools Hub,"Research hub for AI video generators, avatar video, creative editing, and short-form production workflows.",https://smileaireviewhub.com/assets/og/site.svg,summary_large_image,https://smileaireviewhub.com/assets/og/site.svg
/hub/ai-voice/,PASS,,AI Voice Tools Hub,"Research hub for AI voice generators, narration tools, voiceover workflows, and audio content production.",https://smileaireviewhub.com/assets/og/site.svg,summary_large_image,https://smileaireviewhub.com/assets/og/site.svg
/hub/ai-writing/,PASS,,AI Writing Tools Hub,"Research hub for AI writing tools, marketing copy, content workflows, alternatives, and buyer-intent articles.",https://smileaireviewhub.com/assets/og/site.svg,summary_large_image,https://smileaireviewhub.com/assets/og/site.svg
/hub/crm/,PASS,,CRM Tools Hub,"Research hub for CRM software, sales workflow tools, customer management, and startup CRM comparisons.",https://smileaireviewhub.com/assets/og/site.svg,summary_large_image,https://smileaireviewhub.com/assets/og/site.svg
/hub/email-marketing/,PASS,,Email Marketing Tools Hub,"Research hub for email marketing platforms, automation, newsletters, CRM-connected campaigns, and alternatives.",https://smileaireviewhub.com/assets/og/site.svg,summary_large_image,https://smileaireviewhub.com/assets/og/site.svg
/hub/marketing/,PASS,,AI Marketing Tools Hub,"Research hub for marketing software, ad creative tools, CRM, SEO, email marketing, and conversion workflows.",https://smileaireviewhub.com/assets/og/site.svg,summary_large_image,https://smileaireviewhub.com/assets/og/site.svg
/hub/productivity/,PASS,,AI Productivity Tools Hub,"Research hub for AI productivity, meeting tools, knowledge management, scheduling, and team workflows.",https://smileaireviewhub.com/assets/og/site.svg,summary_large_image,https://smileaireviewhub.com/assets/og/site.svg
/hub/website-builders/,PASS,,Website Builders Hub,"Research hub for website builders, landing page tools, CMS platforms, and AI website generation workflows.",https://smileaireviewhub.com/assets/og/site.svg,summary_large_image,https://smileaireviewhub.com/assets/og/site.svg
/hubs/,PASS,,Hubs - MS Smile AI Review Hub,"Research hub index for AI and SaaS categories, reviews, comparisons, pricing pages, and buyer decision paths.",https://smileaireviewhub.com/assets/og/site.svg,summary_large_image,https://smileaireviewhub.com/assets/og/site.svg
/hubspot/,PASS,,"HubSpot Review: Features, Pros, Cons, Pricing Notes","Review nghiên cứu về HubSpot: workflow phù hợp, điểm mạnh, hạn chế, pricing note, alternatives, FAQ và affiliate disclosure.",https://smileaireviewhub.com/assets/og/hubspot.svg,summary_large_image,https://smileaireviewhub.com/assets/og/hubspot.svg
/./,PASS,,MS Smile AI Review Hub,Independent-style AI and SaaS review hub with practical reviews and comparisons.,https://smileaireviewhub.com/assets/og/home.svg,summary,https://smileaireviewhub.com/assets/og/home.svg
/jasper/,PASS,,"Jasper Review: Features, Pros, Cons, Pricing Notes","Review nghiên cứu về Jasper: workflow phù hợp, điểm mạnh, hạn chế, pricing note, alternatives, FAQ và affiliate disclosure.",https://smileaireviewhub.com/assets/og/jasper.svg,summary_large_image,https://smileaireviewhub.com/assets/og/jasper.svg
/jasper-ai/,PASS,,"Jasper AI Review: Features, Pros, Cons, Pricing Notes","Review nghiên cứu về Jasper AI: workflow phù hợp, điểm mạnh, hạn chế, pricing note, alternatives, FAQ và affiliate disclosure.",https://smileaireviewhub.com/assets/og/jasper-ai.svg,summary_large_image,https://smileaireviewhub.com/assets/og/jasper-ai.svg
/jasper-pricing/,PASS,,Giá Jasper: những điểm cần kiểm tra trước khi mua,"Hướng dẫn nghiên cứu về giá Jasper. Pricing có thể thay đổi, nên cần xác minh plan hiện tại, giới hạn sử dụng, điều khoản hủy, alternatives và policy chính thức.",https://smileaireviewhub.com/assets/og/site.svg,summary_large_image,https://smileaireviewhub.com/assets/og/site.svg
/make/,PASS,,"Make Review: Features, Pros, Cons, Pricing Notes","Review nghiên cứu về Make: workflow phù hợp, điểm mạnh, hạn chế, pricing note, alternatives, FAQ và affiliate disclosure.",https://smileaireviewhub.com/assets/og/make.svg,summary_large_image,https://smileaireviewhub.com/assets/og/make.svg
/make-pricing/,PASS,,Giá Make: những điểm cần kiểm tra trước khi mua,"Hướng dẫn nghiên cứu về giá Make. Pricing có thể thay đổi, nên cần xác minh plan hiện tại, giới hạn sử dụng, điều khoản hủy, alternatives và policy chính thức.",https://smileaireviewhub.com/assets/og/site.svg,summary_large_image,https://smileaireviewhub.com/assets/og/site.svg
/marketing-alternatives/,PASS,,Best Marketing Alternatives for 2026,"Editorial research guide for marketing alternatives. Compare realistic options, risks, official pricing checks, and tracking-safe next steps before choosing a tool.",https://smileaireviewhub.com/assets/og/site.svg,summary_large_image,https://smileaireviewhub.com/assets/og/site.svg
/marketing-software-review/,PASS,,Marketing Software Review: Research-Style Review for 2026,"Editorial research guide for marketing software review. Compare realistic options, risks, official pricing checks, and tracking-safe next steps before choosing a tool.",https://smileaireviewhub.com/assets/og/site.svg,summary_large_image,https://smileaireviewhub.com/assets/og/site.svg
/media-kit/,PASS,,Media Kit - MS Smile AI Review Hub,"Brand, category, contact, and social preview information.",https://smileaireviewhub.com/assets/og/site.svg,summary_large_image,https://smileaireviewhub.com/assets/og/site.svg
/notion/,PASS,,"Notion Review: Features, Pros, Cons, Pricing Notes","Review nghiên cứu về Notion: workflow phù hợp, điểm mạnh, hạn chế, pricing note, alternatives, FAQ và affiliate disclosure.",https://smileaireviewhub.com/assets/og/notion.svg,summary_large_image,https://smileaireviewhub.com/assets/og/notion.svg
/notion-ai/,PASS,,"Notion AI Review: Features, Pros, Cons, Pricing Notes","Review nghiên cứu về Notion AI: workflow phù hợp, điểm mạnh, hạn chế, pricing note, alternatives, FAQ và affiliate disclosure.",https://smileaireviewhub.com/assets/og/notion-ai.svg,summary_large_image,https://smileaireviewhub.com/assets/og/notion-ai.svg
/pipedrive/,PASS,,"Pipedrive Review: Features, Pros, Cons, Pricing Notes","Review nghiên cứu về Pipedrive: workflow phù hợp, điểm mạnh, hạn chế, pricing note, alternatives, FAQ và affiliate disclosure.",https://smileaireviewhub.com/assets/og/pipedrive.svg,summary_large_image,https://smileaireviewhub.com/assets/og/pipedrive.svg
/pipedrive-crm/,PASS,,"Pipedrive CRM Review: Features, Pros, Cons, Pricing Notes","Review nghiên cứu về Pipedrive CRM: workflow phù hợp, điểm mạnh, hạn chế, pricing note, alternatives, FAQ và affiliate disclosure.",https://smileaireviewhub.com/assets/og/pipedrive-crm.svg,summary_large_image,https://smileaireviewhub.com/assets/og/pipedrive-crm.svg
/pricing/activecampaign/,PASS,,"ActiveCampaign Pricing Guide: Plans, Trial Notes, and Buying Risks","ActiveCampaign pricing research for Email Marketing buyers. Review plan fit, hidden cost risks, alternatives, official pricing checks, and safe next steps before buying.",https://smileaireviewhub.com/assets/og/site.svg,summary_large_image,https://smileaireviewhub.com/assets/og/site.svg
/pricing/canva/,PASS,,"Canva Pricing Guide: Plans, Trial Notes, and Buying Risks","Canva pricing research for AI Design buyers. Review plan fit, hidden cost risks, alternatives, official pricing checks, and safe next steps before buying.",https://smileaireviewhub.com/assets/og/site.svg,summary_large_image,https://smileaireviewhub.com/assets/og/site.svg
